unused step name: s1-insert-select-2
unused step name: s2-begin
unused step name: s2-commit
unused step name: s2-update-15
Parsed test spec with 2 sessions

starting permutation: s1-begin s1-insert s2-insert s1-commit s1-select-all
step s1-begin: 
    BEGIN;

step s1-insert: 
    INSERT INTO test_iceberg_dml VALUES(1);

step s2-insert: 
    INSERT INTO test_iceberg_dml VALUES(2);
 <waiting ...>
step s1-commit: 
    COMMIT;

step s2-insert: <... completed>
step s1-select-all: 
   SELECT * FROM test_iceberg_dml ORDER BY 1,2;

key|value
---+-----
  1|     
  2|     
(2 rows)


starting permutation: s1-begin s1-delete s2-delete s1-commit s1-select-all
step s1-begin: 
    BEGIN;

step s1-delete: 
    DELETE FROM test_iceberg_dml WHERE key = 1;

step s2-delete: 
    DELETE FROM test_iceberg_dml WHERE key = 1;
 <waiting ...>
step s1-commit: 
    COMMIT;

step s2-delete: <... completed>
step s1-select-all: 
   SELECT * FROM test_iceberg_dml ORDER BY 1,2;

key|value
---+-----
(0 rows)


starting permutation: s1-begin s1-update-1 s2-delete s1-commit s1-select-all
step s1-begin: 
    BEGIN;

step s1-update-1: 
    UPDATE test_iceberg_dml SET key = 15 WHERE key = 1;

step s2-delete: 
    DELETE FROM test_iceberg_dml WHERE key = 1;
 <waiting ...>
step s1-commit: 
    COMMIT;

step s2-delete: <... completed>
step s1-select-all: 
   SELECT * FROM test_iceberg_dml ORDER BY 1,2;

key|value
---+-----
(0 rows)


starting permutation: s1-begin s1-update-1 s2-update-1 s1-commit s1-select-all
step s1-begin: 
    BEGIN;

step s1-update-1: 
    UPDATE test_iceberg_dml SET key = 15 WHERE key = 1;

step s2-update-1: 
    UPDATE test_iceberg_dml SET key = 16 WHERE key = 1;
 <waiting ...>
step s1-commit: 
    COMMIT;

step s2-update-1: <... completed>
step s1-select-all: 
   SELECT * FROM test_iceberg_dml ORDER BY 1,2;

key|value
---+-----
(0 rows)


starting permutation: s1-begin s1-insert s2-delete s1-commit s1-select-all
step s1-begin: 
    BEGIN;

step s1-insert: 
    INSERT INTO test_iceberg_dml VALUES(1);

step s2-delete: 
    DELETE FROM test_iceberg_dml WHERE key = 1;

step s1-commit: 
    COMMIT;

step s1-select-all: 
   SELECT * FROM test_iceberg_dml ORDER BY 1,2;

key|value
---+-----
  1|     
(1 row)


starting permutation: s1-begin s1-insert s2-update-1 s1-commit s1-select-all
step s1-begin: 
    BEGIN;

step s1-insert: 
    INSERT INTO test_iceberg_dml VALUES(1);

step s2-update-1: 
    UPDATE test_iceberg_dml SET key = 16 WHERE key = 1;

step s1-commit: 
    COMMIT;

step s1-select-all: 
   SELECT * FROM test_iceberg_dml ORDER BY 1,2;

key|value
---+-----
  1|     
(1 row)


starting permutation: s1-insert s1-begin s1-insert s2-delete s1-commit s1-select-all
step s1-insert: 
    INSERT INTO test_iceberg_dml VALUES(1);

step s1-begin: 
    BEGIN;

step s1-insert: 
    INSERT INTO test_iceberg_dml VALUES(1);

step s2-delete: 
    DELETE FROM test_iceberg_dml WHERE key = 1;
 <waiting ...>
step s1-commit: 
    COMMIT;

step s2-delete: <... completed>
step s1-select-all: 
   SELECT * FROM test_iceberg_dml ORDER BY 1,2;

key|value
---+-----
  1|     
(1 row)


starting permutation: s1-insert s1-begin s1-insert s2-update-1 s1-commit s1-select-all
step s1-insert: 
    INSERT INTO test_iceberg_dml VALUES(1);

step s1-begin: 
    BEGIN;

step s1-insert: 
    INSERT INTO test_iceberg_dml VALUES(1);

step s2-update-1: 
    UPDATE test_iceberg_dml SET key = 16 WHERE key = 1;
 <waiting ...>
step s1-commit: 
    COMMIT;

step s2-update-1: <... completed>
step s1-select-all: 
   SELECT * FROM test_iceberg_dml ORDER BY 1,2;

key|value
---+-----
  1|     
 16|     
(2 rows)


starting permutation: s1-begin s1-select-all s2-select-all s1-commit
step s1-begin: 
    BEGIN;

step s1-select-all: 
   SELECT * FROM test_iceberg_dml ORDER BY 1,2;

key|value
---+-----
(0 rows)

step s2-select-all: 
   SELECT * FROM test_iceberg_dml ORDER BY 1,2;

key|value
---+-----
(0 rows)

step s1-commit: 
    COMMIT;


starting permutation: s1-insert s1-begin s1-select-all s2-delete s1-commit
step s1-insert: 
    INSERT INTO test_iceberg_dml VALUES(1);

step s1-begin: 
    BEGIN;

step s1-select-all: 
   SELECT * FROM test_iceberg_dml ORDER BY 1,2;

key|value
---+-----
  1|     
(1 row)

step s2-delete: 
    DELETE FROM test_iceberg_dml WHERE key = 1;

step s1-commit: 
    COMMIT;


starting permutation: s1-insert s1-begin s1-select-all s2-update-1 s1-commit
step s1-insert: 
    INSERT INTO test_iceberg_dml VALUES(1);

step s1-begin: 
    BEGIN;

step s1-select-all: 
   SELECT * FROM test_iceberg_dml ORDER BY 1,2;

key|value
---+-----
  1|     
(1 row)

step s2-update-1: 
    UPDATE test_iceberg_dml SET key = 16 WHERE key = 1;

step s1-commit: 
    COMMIT;


starting permutation: s1-insert s1-begin s1-select-all s2-insert s1-commit
step s1-insert: 
    INSERT INTO test_iceberg_dml VALUES(1);

step s1-begin: 
    BEGIN;

step s1-select-all: 
   SELECT * FROM test_iceberg_dml ORDER BY 1,2;

key|value
---+-----
  1|     
(1 row)

step s2-insert: 
    INSERT INTO test_iceberg_dml VALUES(2);

step s1-commit: 
    COMMIT;


starting permutation: s1-begin s1-insert-select-1 s2-insert-select-1 s1-commit
step s1-begin: 
    BEGIN;

step s1-insert-select-1: 
    INSERT INTO test_iceberg_dml SELECT * FROM test_iceberg_dml_2;

step s2-insert-select-1: 
    INSERT INTO test_iceberg_dml SELECT * FROM test_iceberg_dml_2;

step s1-commit: 
    COMMIT;


starting permutation: s1-begin s1-insert-select-1 s2-insert-select-2 s1-commit
step s1-begin: 
    BEGIN;

step s1-insert-select-1: 
    INSERT INTO test_iceberg_dml SELECT * FROM test_iceberg_dml_2;

step s2-insert-select-2: 
    INSERT INTO test_iceberg_dml_2 SELECT * FROM test_iceberg_dml;

step s1-commit: 
    COMMIT;


starting permutation: s1-insert-2 s1-begin s1-insert-select-1 s2-insert-select-1 s1-commit
step s1-insert-2: 
    INSERT INTO test_iceberg_dml_2 VALUES(1);

step s1-begin: 
    BEGIN;

step s1-insert-select-1: 
    INSERT INTO test_iceberg_dml SELECT * FROM test_iceberg_dml_2;

step s2-insert-select-1: 
    INSERT INTO test_iceberg_dml SELECT * FROM test_iceberg_dml_2;
 <waiting ...>
step s1-commit: 
    COMMIT;

step s2-insert-select-1: <... completed>

starting permutation: s1-insert-2 s1-begin s1-insert-select-1 s2-insert-select-1 s1-commit
step s1-insert-2: 
    INSERT INTO test_iceberg_dml_2 VALUES(1);

step s1-begin: 
    BEGIN;

step s1-insert-select-1: 
    INSERT INTO test_iceberg_dml SELECT * FROM test_iceberg_dml_2;

step s2-insert-select-1: 
    INSERT INTO test_iceberg_dml SELECT * FROM test_iceberg_dml_2;
 <waiting ...>
step s1-commit: 
    COMMIT;

step s2-insert-select-1: <... completed>
